,record_id,title,abstract,label_included,label_abstract_screening,duplicate_record_id
302,303,How organizational escalation prevention potential affects success of implementation of innovations: electronic medical records in hospitals,"Background Escalation of commitment is the tendency that (innovation) projects continue, even if it is clear that they will not be successful and/or become extremely costly. Escalation prevention potential (EPP), the capability of an organization to stop or steer implementation processes that do not meet their expectations, may prevent an organization of losing time and money on unsuccessful projects. EPP consists of a set of checks and balances incorporated in managerial practices that safeguard management against irrational (but very human) decisions and may limit the escalation of implementation projects. We study whether successful implementation of electronic medical records (EMRs) relates to EPP and investigate the organizational factors accounting for this relationship.  Methods Structural equation modelling (SEM), using questionnaire data of 427 doctors and 631 nurses who had experience with implementation and use of EMRs in hospitals, was applied to study whether formal governance and organizational culture mediate the relationship between EPP and the perceived added value of EMRs.  Results Doctors and nurses in hospitals with more EPP report more successful implementation of EMR (in terms of perceived added value of the EMR). Formal governance mediates the relation between EPP and implementation success. We found no evidence that open or innovative culture explains the relationship between EPP and implementation success.  Conclusions There is a positive relationship between the level of EPP and perceived added value of EMRs. This relationship is explained by formal governance mechanisms of organizations. This means that management has a set of tangible tools to positively affect the success of innovation processes. However, it also means that management needs to be able to critically reflect on its (previous) actions and decisions and is willing to change plans if elements of EPP signal that the implementation process is hampered.",0,0,
303,304,Efficacy and safety of sucrose for procedural pain relief in preterm and term neonates,"BACKGROUND: Preterm and acutely ill term neonates who are hospitalized in a neonatal intensive care unit are subjected to multiple frequent invasive and painful procedures aimed at improving their outcome. Although several trials to determine the efficacy of sucrose for managing procedural pain in preterm and acutely ill term neonates have been developed, these have generally lacked methodological rigor and have not provided clinicians with clear practice guidelines. OBJECTIVES: To compare the efficacy and safety of three interventions for relieving procedural pain associated with heel lances in preterm and term neonates, and to explore the influence of contextual factors including sex, severity of illness, and prior painful procedures on pain responses. METHODS: In a randomized controlled trial, 190 neonates were stratified by gestational age and then randomized to receive (a) sucrose and nonnutritive sucking (n = 64), (b) sucrose alone (n = 62), or (c) sterile water and nonnutritive sucking (control) (n = 64) to evaluate the efficacy (pain response as measured using the Premature Infant Pain Profile) (Stevens, Johnson, Petryshen, & Taddio, 1996) and safety (adverse events) following a scheduled heel lance during the first week of life. Stratification was used to control for the effects of age on pain response. RESULTS: Significant differences in pain response existed among treatment groups (F = 22.49, p <.001), with the lowest mean Premature Infant Pain Profile scores in the sucrose and nonnutritive sucking group. Efficacy of sucrose following a heel lance was not affected by severity of illness, postnatal age, or number of painful procedures. Intervention group and sex explained 12% of the variance in Premature Infant Pain Profile scores. Few adverse events occurred (n = 6), and none of them required medical or nursing interventions. CONCLUSIONS: The combination of sucrose and nonnutritive sucking is the most efficacious intervention for single heel lances. Research on the effects of gestational age on the efficacy and safety of repeated doses of sucrose is required.",0,0,
304,305,Canadian Contraception Consensus (Part 2 of 4),"OBJECTIVE: To provide guidelines for health care providers on the use of contraceptive methods to prevent pregnancy and on the promotion of healthy sexuality. OUTCOMES: Guidance for Canadian practitioners on overall effectiveness, mechanism of action, indications, contraindications, non-contraceptive benefits, side effects and risks, and initiation of cited contraceptive methods""; family planning in the context of sexual health and general well-being; contraceptive counselling methods; and access to, and availability of, cited contraceptive methods in Canada. EVIDENCE: Published literature was retrieved through searches of Medline and The Cochrane Database from January 1994 to January 2015 using appropriate controlled vocabulary (e.g., contraception, sexuality, sexual health) and key words (e.g., contraception, family planning, hormonal contraception, emergency contraception). Results were restricted to systematic reviews, randomized control trials/controlled clinical trials, and observational studies published in English from January 1994 to January 2015. Searches were updated on a regular basis and incorporated in the guideline to June 2015. Grey (unpublished) literature was identified through searching the websites of health technology assessment and health technology-related agencies, clinical practice guideline collections, clinical trial registries, and national and international medical specialty societies. VALUES: The quality of the evidence in this document was rated using the criteria described in the Report of the Canadian Task Force on Preventive Health Care (Table). Chapter 1: Contraception in Canada Summary Statements 1. Canadian women spend a significant portion of their lives at risk of an unintended pregnancy. (II-2) 2. Effective contraceptive methods are underutilized in Canada, particularly among vulnerable populations. (II-2) 3. Long-acting reversible contraceptive methods, including contraceptive implants and intrauterine contraception (copper-releasing and levonorgestrel-releasing devices/systems), are the most effective reversible contraceptive methods and have the highest continuation rates. (II-1) 4. Canada currently does not collect reliable data to determine the use of contraceptive methods, abortion rates, and the prevalence of unintended pregnancy among reproductive-age women. (II-2) 5. A universal subsidy for contraceptive methods as provided by many of Canada's peer nations and a few Canadian provinces may produce health system cost-savings. (II-2) 6. Health Canada approval processes for contraceptives have been less efficient than those of other drug approval agencies and Health Canada processes for other classes of pharmaceuticals. (II-2) 7. It is feasible and safe for contraceptives and family planning services to be provided by appropriately trained allied health professionals such as midwives, registered nurses, nurse practitioners, and pharmacists. (II-2) Recommendations 1. Contraceptive counselling should include a discussion of typical use failure rates and the importance of using the contraceptive method consistently and correctly in order to avoid pregnancy. (II-2A) 2. Women seeking contraception should be counselled on the wide range of effective methods of contraception available, including long-acting reversible contraceptive methods (LARCs). LARCs are the most effective methods of reversible contraception, have high continuation rates, and should be considered when presenting contraceptive options to any woman of reproductive age. (II-2A) 3. Family planning counselling should include counselling on the decline of fertility associated with increasing female age. (III-A) 4. Health policy supporting a universal contraception subsidy and strategies to promote the uptake of highly effective methods as cost-saving measures that improve health and health equity should be considered by Canadian health decision makers. (III-B) 5. Canadian health jurisdictions should consider expanding the scope of practice of other trained professionals such as nurses, nurse practitioners, midwives, and pharmacists and promoting task-sharing in family planning. (II-2B) 6. The Canadian Community Health Survey should include adequate reproductive health indicators in order for health care providers and policy makers to make appropriate decisions regarding reproductive health policies and services in Canada. (III-B) 7. Health Canada processes and policies should be reviewed to ensure a wide range of modern contraceptive methods are available to Canadian women. (III-B) Chapter 2: Contraceptive Care and Access Summary Statements 8. Although there are many contraceptive options in Canada, only a narrow range of contraceptive methods are commonly used by those of reproductive age. (II-3) 9. Condom use decreases with longer relationship tenure and when the sexual partner is considered to be the main partner, likely due to a lower perceived risk of sexually transmitted infection in that relationship. Condom use may also decrease markedly as an unintended consequence when an effective non-barrier method, such as hormonal contraception or intrauterine contraception, is initiated. (II-3) 10. Family planning counselling provides a natural segue into screening for concerns about sexual function or intimate partner violence. (III) 11. Well-informed and well-motivated individuals who have developed skills to practise safer sex behaviours are more likely to use contraceptive and safer sex methods effectively and consistently. (II-2) Recommendations 8. Comprehensive family planning services, including abortion services, should be accessible to all Canadians regardless of geographic location. These services should be confidential, non-judgemental, and respectful of individuals' privacy and cultural contexts. (III-A) 9. A contraceptive visit should include history taking, screening for contraindications, dispensing or prescribing a method of contraception, and exploring contraceptive choice and adherence in the broader context of the individual's sexual behaviour, reproductive health risk, social circumstances, and relevant belief systems. (III-B) 10. Health care providers should provide practical information on the wide range of contraceptive options and their potential non-contraceptive benefits and assist women and their partners in determining the best user-method fit. (III-B) 11. Health care providers should assist women and men in developing the skills necessary to negotiate the use of contraception and the correct and consistent use of a chosen method. (III-B) 12. Contraceptive care should include discussion and management of the risk of sexually transmitted infection, including appropriate recommendations for condom use and dual protection, STI screening, post-exposure prophylaxis, and Hepatitis B and human papillomavirus vaccination. (III-B) 13. Health care providers should emphasize the use of condoms not only for protection against sexually transmitted infection, but also as a back-up method when adherence to a hormonal contraceptive may be suboptimal. (I-A) 14. Health care providers should be aware of current media controversies in reproductive health and acquire relevant evidence-based information that can be briefly and directly communicated to their patients. (III-B) 15. Referral resources for intimate partner violence, sexually transmitted infections, sexual dysfunction, induced abortion services, and child protection services should be available to help clinicians provide contraceptive care in the broader context of women's health. (III-B) Chapter 3: Emergency Contraception Summary Statements 12. The copper intrauterine device is the most effective method of emergency contraception. (II-2) 13. A copper intrauterine device can be used for emergency contraception up to 7 days after unprotected intercourse provided that pregnancy has been ruled out and there are no other contraindications to its insertion. (II-2) 14. Levonorgestrel emergency contraception is effective up to 5 days (120 hours) after intercourse;"" its effectiveness decreases as the time between unprotected intercourse and ingestion increases. (II-2) 15. Ulipristal acetate for emergency contraception is more effective than levonorgestrel emergency contraception up to 5 days after unprotected intercourse. This difference in effectiveness is more pronounced as the time from unprotected intercourse increases, especially after 72 hours. (I) 16. Hormonal emergency contraception (levonorgestrel emergency contraception and ulipristal acetate for emergency contraception) is not effective if taken on the day of ovulation or after ovulation. (II-2) 17. Levonorgestrel emergency contraception may be less effective in women with a body mass index > 25 kg/m2 and ulipristal acetate for emergency contraception may be less effective in women with a body mass index > 35 kg/m2. However, hormonal emergency contraception may still retain some effectiveness regardless of a woman's body weight or body mass index. (II-2) 18. Hormonal emergency contraception is associated with higher failure rates when women continue to have subsequent unprotected intercourse. (II-2) 19. Hormonal contraception can be initiated the day of or the day following the use of levonorgestrel emergency contraception, with back-up contraception used for the first 7 days. (III) 20. Hormonal contraception can be initiated 5 days following the use of ulipristal acetate for emergency contraception, with back-up contraception used for the first 14 days. (III) Recommendations 16. All emergency contraception should be initiated as soon as possible after unprotected intercourse. (II-2A) 17. Women should be informed that the copper intrauterine device (IUD) is the most effective method of emergency contraception and can be used by any woman with no contraindications to IUD use. (II-3A) 18.",0,0,
305,306,Optimal patterns of care in patients with chronic obstructive pulmonary disease,"An intimate relationship exists between the physiological processes of respiration and swallowing at all levels of neuromotor control and peripheral function in healthy adults. Little is known regarding the potential alterations in these patterns in patients with chronic obstructive pulmonary disease (COPD), yet the impact of swallowing impairment and aspiration on the health outcomes of patients with COPD may be significant. COPD is a common comorbidity in patients with head and neck cancer and neurological disorders seen by swallowing clinicians, and warrants consideration during swallowing treatment. This article summarizes reports of alterations in the nutritional status, airway protective mechanisms, and swallowing efficiency that potentially contribute to or exacerbate the chronic and debilitating pulmonary condition. Care guidelines are given for modification of eating and swallowing behavior to optimize the health status of the patient with COPD. The need for controlled clinical trials for validation of the impact of these care guidelines on clinical outcomes is explained.",0,0,
306,307,Costs associated with implementation of computer-assisted clinical decision support system for antenatal and delivery care: case study of Kassena-Nankana district of northern Ghana,"OBJECTIVE: This study analyzed cost of implementing computer-assisted Clinical Decision Support System (CDSS) in selected health care centres in Ghana. METHODS: A descriptive cross sectional study was conducted in the Kassena-Nankana district (KND). CDSS was deployed in selected health centres in KND as an intervention to manage patients attending antenatal clinics and the labour ward. The CDSS users were mainly nurses who were trained. Activities and associated costs involved in the implementation of CDSS (pre-intervention and intervention) were collected for the period between 2009-2013 from the provider perspective. The ingredients approach was used for the cost analysis. Costs were grouped into personnel, trainings, overheads (recurrent costs) and equipment costs (capital cost). We calculated cost without annualizing capital cost to represent financial cost and cost with annualizing capital costs to represent economic cost. RESULTS: Twenty-two trained CDSS users (at least 2 users per health centre) participated in the study. Between April 2012 and March 2013, users managed 5,595 antenatal clients and 872 labour clients using the CDSS. We observed a decrease in the proportion of complications during delivery (pre-intervention 10.74% versus post-intervention 9.64%) and a reduction in the number of maternal deaths (pre-intervention 4 deaths versus post-intervention 1 death). The overall financial cost of CDSS implementation was US$23,316, approximately US$1,060 per CDSS user trained. Of the total cost of implementation, 48% (US$11,272) was pre-intervention cost and intervention cost was 52% (US$12,044). Equipment costs accounted for the largest proportion of financial cost: 34% (US$7,917). When economic cost was considered, total cost of implementation was US$17,128-lower than the financial cost by 26.5%. CONCLUSIONS: The study provides useful information in the implementation of CDSS at health facilities to enhance health workers' adherence to practice guidelines and taking accurate decisions to improve maternal health care.",0,0,
307,308,Use of a decision aid including information on overdetection to support informed choice about breast cancer screening: a randomised controlled trial.,"Background Mammography screening can reduce breast cancer mortality. However, most women are unaware that inconsequential disease can also be detected by screening, leading to overdiagnosis and overtreatment. We aimed to investigate whether including information about overdetection of breast cancer in a decision aid would help women aged around 50 years to make an informed choice about breast screening.  Methods We did a community-based, parallel-group, randomised controlled trial in New South Wales, Australia, using a random cohort of women aged 48–50 years. Recruitment to the study was done by telephone""; women were eligible if they had not had mammography in the past 2 years and did not have a personal or strong family history of breast cancer. With a computer program, we randomly assigned 879 participants to either the intervention decision aid (comprising evidence-based explanatory and quantitative information on overdetection, breast cancer mortality reduction, and false positives) or a control decision aid (including information on breast cancer mortality reduction and false positives). Participants and interviewers were masked to group assignment. The primary outcome was informed choice (defined as adequate knowledge and consistency between attitudes and screening intentions), which we assessed by telephone interview about 3 weeks after random allocation. The primary outcome was analysed in all women who completed the relevant follow-up interview questions fully. This trial is registered with the Australian New Zealand Clinical Trials Registry, number ACTRN12613001035718.  Findings Between January, 2014, and July, 2014, 440 women were allocated to the intervention group and 439 were assigned to the control group. 21 women in the intervention group and 20 controls were lost to follow-up; a further ten women assigned to the intervention and 11 controls did not answer all questions on attitudes. Therefore, 409 women in the intervention group and 408 controls were analysed for the primary outcome. 99 (24%) of 409 women in the intervention group made an informed choice compared with 63 (15%) of 408 in the control group (difference 9%, 95% CI 3–14; p=0·0017). Compared with controls, more women in the intervention group met the threshold for adequate overall knowledge (122/419 [29%] vs 71/419 [17%]; difference 12%, 95% CI 6–18; p<0·0001), fewer women expressed positive attitudes towards screening (282/409 [69%] vs 340/408 [83%]; 14%, 9–20; p<0·0001), and fewer women intended to be screened (308/419 [74%] vs 363/419 [87%]; 13%, 8–19;"" p<0·0001). When conceptual knowledge alone was considered, 203 (50%) of 409 women in the intervention group made an informed choice compared with 79 (19%) of 408 in the control group (p<0·0001).  Interpretation Information on overdetection of breast cancer provided within a decision aid increased the number of women making an informed choice about breast screening. Becoming better informed might mean women are less likely to choose screening.",0,1,
308,309,The compensation of patients injured in clinical trials,"The problem of 'no fault' compensation for patients who suffer adverse effects as a result of their participation in clinical trials is discussed in the light of the guidelines issued by the Association of the British Pharmaceutical Industry (ABPI) and our recent experiences in reviewing protocols submitted to the local ethics of surgical research sub-committee. We have found a variety of qualifications being applied by pharmaceutical firms which are not in the spirit of the guidelines, let alone the interests of the patient, and we suggest a means whereby the patients can be assured of fair treatment in the event of 'no fault' injury.",0,0,
309,310,Congenital rubella syndrome burden in Morocco: a rapid retrospective assessment,"BackgroundWHO recommends that countries considering introduction of rubella vaccine into their immunisation programme assess their burden of congenital rubella syndrome, to determine whether vaccination is warranted. However, few guidelines exist for such assessments in developing countries. We retrospectively estimated the burden of congenital rubella syndrome in Morocco, and assessed our methods of rapid case finding."";"" BackgroundWHO recommends that countries considering introduction of rubella vaccine into their immunisation programme assess their burden of congenital rubella syndrome, to determine whether vaccination is warranted. However, few guidelines exist for such assessments in developing countries. We retrospectively estimated the burden of congenital rubella syndrome in Morocco, and assessed our methods of rapid case finding.",0,0,
310,311,Behavioral Counseling After Screening for Alcohol Misuse in Primary Care: A Systematic Review and Meta-analysis for the U.S. Preventive Services Task Force,"Background:Alcohol misuse, which includes the full spectrum from risky drinking to alcohol dependence, is a leading cause of preventable death in the United States.Purpose:To evaluate the benefits and harms of behavioral counseling interventions for adolescents and adults who misuse alcohol.Data Sources:MEDLINE, EMBASE, the Cochrane Library, CINAHL, PsycINFO, International Pharmaceutical Abstracts, and reference lists of published literature (January 1985 through January 2012, limited to English-language articles).Study Selection:Controlled trials at least 6 months' duration that enrolled persons with alcohol misuse identified by screening in primary care settings and evaluated behavioral counseling interventions.Data Extraction:One reviewer extracted data and a second checked accuracy. Two independent reviewers assigned quality ratings and graded the strength of the evidence.Data Synthesis:The 23 included trials generally excluded persons with alcohol dependence. The best evidence was for brief (10- to 15-minute) multicontact interventions. Among adults receiving behavioral interventions, consumption decreased by 3.6 drinks per week from baseline (weighted mean difference, 3.6 drinks/wk [95% CI, 2.4 to 4.8 drinks/wk]""; 10 trials; 4332 participants), 12% fewer adults reported heavy drinking episodes (risk difference, 0.12 [CI, 0.07 to 0.16]; 7 trials; 2737 participants), and 11% more adults reported drinking less than the recommended limits (risk difference, 0.11 [CI, 0.08 to 0.13]; 9 trials;"" 5973 participants) over 12 months compared with control participants (moderate strength of evidence). Evidence was insufficient to draw conclusions about accidents, injuries, or alcohol-related liver problems. Trials enrolling young adults or college students showed reduced consumption and fewer heavy drinking episodes (moderate strength of evidence). Little or no evidence of harms was found.Limitations:Results may be biased to the null because the behavior of control participants could have been affected by alcohol misuse assessments. In addition, evidence is probably inapplicable to persons with alcohol dependence and selective reporting may have occurred.Conclusion:Behavioral counseling interventions improve behavioral outcomes for adults with risky drinking.Primary Funding Source:Agency for Healthcare Research and Quality.",0,0,
