,record_id,title,abstract,label_included,label_abstract_screening,duplicate_record_id
200,201,Helicobacter pylori management: how to improve the therapeutic confusion in practice,"There appears to be a disconnect between current guidelines for Helicobacter pylori testing and treatment, and clinical practice, including physician beliefs and actual prescribing patterns. In particular, there are markedly different approaches in primary and secondary care, and country-specific differences in eradication therapy for H pylori infection. Although most physicians do not believe that H pylori causes non-ulcer dyspepsia, the majority appear to prescribe eradication. Less information is available on the management of H pylori infection and gastro-esophageal reflux disease, and more marked differences in attitudes and practice occur in this condition. Even in peptic ulcer disease, where most clinicians both in primary and in secondary care believe H pylori should be eradicated, there is often a breakdown in the translation of this belief into practice. There is also confusion in terms of treatment regimens applied for H pylori eradication. Eradication regimens are less successful in practice than in clinical trials. Furthermore, a sizable proportion of patients with peptic ulcer remain symptomatic despite cure of the ulcer diathesis, which may undermine confidence. Therapeutic confusion about what to prescribe, side effects limiting compliance, bacterial resistance, and socioeconomic factors may all impair therapeutic success with eradication therapy in practice. Unfortunately, it has been well documented that guidelines alone are likely to have little or no impact in practice. Publication in a journal is unlikely to lead to effective implementation in primary care. On the basis of available evidence, clinical behaviour is most likely changed when guidelines are developed by the peer group of clinicians for whom they were intended, are disseminated through a specific educational program, and are implemented by applying, preferably during the consultation, specific reminders.",0,0,
201,202,"Short course of cognitive behavioural therapy may reduce health anxiety, say researchers","A short course of cognitive behavioural therapy delivered by nurses with minimal training would be an effective and relatively cheap way to reduce health anxiety in general medical clinics, researchers claim. Health anxiety or hypochondriasis places a substantial burden on health services because it leads to multiple consultations and investigations. Cognitive behavioural therapy is known to be an effective treatment for other anxiety disorders, but there are shortages of specialist therapists and long waiting lists for treatment. The Cognitive Behaviour Therapy for Health Anxiety in Medical Patients (CHAMP) study randomised 445 people with abnormal health anxiety who were attending gastroenterological, neurological, and respiratory medicine clinics in â€¦",0,0,
202,203,"Using Wearable Devices and Smartphones to Track Physical Activity: Initial Activation, Sustained Use, and Step Counts Across Sociodemographic Characteristics in a National Sample","Background: Interest in using wearable devices and smartphones to monitor daily health behaviors, such as physical activity, is growing (1, 2). Many large employers are using these technologies in workplace wellness programs (3). The precision medicine initiative has described how data collected by these technologies can be used to better target interventions. However, the characteristics of persons who use these devices are poorly understood. Objective: To describe rates of initial use of activity trackers, sustained use after 6 months, and step counts across different sociodemographic characteristics from a wellness program offered across the United States. Methods and Findings: Data on activity tracker use, mean daily step counts, and sociodemographic characteristics between 2014 and 2015 were obtained from Humana for insured persons with access to HumanaVitality (now Go365), a wellness program offered across the United States. Median household income from U.S. Census data was linked using ZIP code. Data were received deidentified and deemed exempt from review by the University of Pennsylvania Institutional Review Board.",0,0,
203,204,Herding: a new phenomenon affecting medical decision-making in multiple sclerosis care? Lessons learned from DIScUTIR MS,"PURPOSE: Herding is a phenomenon by which individuals follow the behavior of others rather than deciding independently on the basis of their own private information. A herding-like phenomenon can occur in multiple sclerosis (MS) when a neurologist follows a therapeutic recommendation by a colleague even though it is not supported by best practice clinical guidelines. Limited information is currently available on the role of herding in medical care. The objective of this study was to determine the prevalence (and its associated factors) of herding in the management of MS. METHODS: We conducted a study among neurologists with expertise in MS care throughout Spain. Participants answered questions regarding the management of 20 case scenarios commonly encountered in clinical practice and completed 3 surveys and 4 experimental paradigms based on behavioral economics. The herding experiment consisted of a case scenario of a 40-year-old woman who has been stable for 3 years on subcutaneous interferon and developed a self-limited neurological event. There were no new magnetic resonance imaging (MRI) lesions. Her neurological examination and disability scores were unchanged. She was advised by an MS neurologist to switch from interferon to fingolimod against best practice guidelines. Multivariable logistic regression analysis was conducted to evaluate factors associated with herding. RESULTS: Out of 161 neurologists who were invited to participate, 96 completed the study (response rate: 60%). Herding was present in 75 (78.1%), having a similar prevalence in MS experts and general neurologists (68.8% vs 82.8%"";"" P=0.12). In multivariate analyses, the number of MS patients seen per week was positively associated with herding (odds ratio [OR] 1.08, 95% CI 1.01-1.14). Conversely, physician's age, gender, years of practice, setting of practice, or risk preferences were not associated with herding. CONCLUSION: Herding was a common phenomenon affecting nearly 8 out of 10 neurologists caring for MS patients. Herding may affect medical decisions and lead to poorer outcomes in the management of MS.",0,0,
204,205,Low-value care: an intractable global problem with no quick fix,,0,0,
205,206,Nurses' representations of caring for intellectually disabled patients and perceived needs to ensure quality care,"AIMS AND OBJECTIVES: To explore nurses' representations of caring for people with an intellectual disability, intervention strategies they currently use, and to identify needs to ensure quality care. BACKGROUND: Nurses work in many environments and with diverse clienteles. Certain clienteles have needs that require specific approaches, such as persons who have an intellectual disability. The care offered to these patients can be influenced by the representations held by the nurses caring for them. DESIGN: Qualitative descriptive study. METHODS: Semi-structured interviews using thematic analysis were conducted with 18 nurses working in hospital and community settings. RESULTS: Nurses are concerned with their ability to recognise the specific nature and complex needs associated with patients' intellectual disabilities, promoting quality care by managing the behavioural and communication challenges, as well as coping with the perceived lack of time and organisation within the work environment. Current strategies involve trying to promote the continuity of care. Participants also identified their learning needs, which are relational and informational in nature. CONCLUSIONS: Nurses appear typically mindful of wanting to provide quality care to patients who have an intellectual disability, while recognising that there are many contextual and practical elements that require improvement to ensure the security of these patients. RELEVANCE TO CLINICAL PRACTICE: Nurses must be educated to adapt to findings emerging from current research showing that people with an intellectual disability want to be part of their local communities and encourage these persons to do so. This can be facilitated through the adoption of specific guidelines, protocols and care programmes. Further research is needed to develop a better understanding of the expectations of these patients and their caregivers, focusing on self-advocacy as well as health promotion techniques, with the goal of enhancing personalised practice standards and reducing health education inequalities for these patients.",0,0,
206,207,The American Society of Clinical Psychopharmacology Survey of Psychopharmacologists' Practice Patterns for the Treatment of Mood Disorders,"BACKGROUND: Optimal successive treatment decisions are not well established after an initial medication nonresponse in major depressive disorder or bipolar disorder. While practice guidelines offer consensus-based expert treatment recommendations, little is known about ""real world"" pharmacology decision making by practicing psychopharmacologists. MATERIALS AND METHODS: We surveyed via Internet the national membership of the American Society of Clinical Psychopharmacology (ASCP) to study preferred pharmacotherapy strategies and factors that influence medication choices for patients with mood disorders. RESULTS: Surveys were returned by 154/752 ASCP members (21%). After nonresponse to a serotonin reuptake inhibitor in major depressive disorder, participants equally favored switching within or across antidepressant classes. After a partial response, adjunctive bupropion was the preferred intervention, followed by changing antidepressant classes. Atypical antipsychotic augmentation was only a fourth-line consideration, even though moderate or marked efficacy was perceived in most instances with olanzapine, aripiprazole, and quetiapine. Respondents favored avoiding antidepressants in bipolar I patients with mixed/cycling features or prior antidepressant-associated mania/hypomania. In rapid cyclers, they advocated antidepressant cessation and preferred the use of atypical antipsychotics and lamotrigine. CONCLUSIONS: Participating psychopharmacologists treating adults with mood disorders report prescribing medications that largely mirror the evidence base with only a few notable exceptions, in consideration of the characteristics of definable clinical subpopulations.",0,0,
207,208,Combined Diet and Physical Activity Promotion Programs to Prevent Type 2 Diabetes Among Persons at Increased Risk: A Systematic Review for the Community Preventive Services Task Force,"Background: Trials have shown efficacy of rigorous diet and physical activity promotion programs to reduce diabetes incidence and improve glycemic measures in adults at increased risk for type 2 diabetes. Purpose: To evaluate diet and physical activity promotion programs for persons at increased risk for type 2 diabetes, primarily to reduce diabetes risk and decrease body weight and glycemia. Data Sources: MEDLINE, the Cochrane Central Register of Controlled Trials, CAB Abstracts, Global Health, and Ovid Health- STAR from 1991 through 27 February 2015, with no language restriction. Study Selection: 8 researchers screened articles for singlegroup or comparative studies of combined diet and physical activity promotion programs with at least 2 sessions over at least 3 months in participants at increased risk for type 2 diabetes. Data Extraction: 7 researchers extracted data on study design""; participant, intervention, and outcome descriptions;"" and results and assessed study quality. Data Synthesis: 53 studies (30 of diet and physical activity promotion programs vs. usual care, 13 of more intensive vs. less intensive programs, and 13 of single programs) evaluated 66 programs. Compared with usual care, diet and physical activity promotion programs reduced type 2 diabetes incidence (risk ratio [RR], 0.59 [95% CI, 0.52 to 0.66]) (16 studies), decreased body weight (net change,-2.2% [CI,-2.9% to-1.4%]) (24 studies) and fasting blood glucose level (net change, -0.12 mmol/L [-2.2 mg/dL] [CI, -0.20 to -0.05 mmol/L {-3.6 to -0.9 mg/ dL}]) (17 studies), and improved other cardiometabolic risk factors. Evidence for clinical events was limited. More intensive programs were more effective. Limitations: Wide variation in diet and physical activity promotion programs limited identification of features most relevant to effectiveness. Evidence on clinical outcomes and in children was sparse. Conclusion: Combined diet and physical activity promotion programs are effective at decreasing diabetes incidence and improving cardiometabolic risk factors in persons at increased risk. More intensive programs are more effective.",0,0,
208,209,"An integrated framework for safety, quality and risk management: an information and incident management system based on a universal patient safety classification","More needs to be done to improve safety and quality and to manage risks in health care. Existing processes are fragmented and there is no single comprehensive source of information about what goes wrong. An integrated framework for the management of safety, quality and risk is needed, with an information and incident management system based on a universal patient safety classification. The World Alliance for Patient Safety provides a platform for the development of a coherent approach"";"" 43 desirable attributes for such an approach are discussed. An example of an incident management and information system serving a patient safety classification is presented, with a brief account of how and where it is currently used. Any such system is valueless unless it improves safety and quality. Quadruple-loop learning (personal, local, national and international) is proposed with examples of how an exemplar system has been successfully used at the various levels. There is currently an opportunity to “get it right” by international cooperation via the World Health Organization to develop an integrated framework incorporating systems that can accommodate information from all sources, manage and monitor things that go wrong, and allow the worldwide sharing of information and the dissemination of tools for the implementation of strategies which have been shown to work.",0,0,
209,210,Influencing antibiotic prescribing by prescriber feedback and management guidelines: a 5-year follow-up,"BACKGROUND: The extent of use of antibiotics for upper respiratory tract infection (URTI) prompted a previous study of an educational intervention based on prescriber feedback and management guidelines. This study demonstrated a reduction in antibiotic prescribing for URTI and a more appropriate choice of antibiotic for tonsillitis/streptococcal pharyngitis. There are few long-term follow-up studies of educational programmes of this kind. OBJECTIVES: This follow-up study aimed to examine if the reduction in antibiotic prescribing observed in the intervention group of the original study remained present after 5 years, and how the prescribing behaviour of the GPs involved in the follow-up differed from a large national survey of GP prescribing. METHODS: Attempts were made to contact the 157 GPs involved in the original study. Of these, 121 were both located and currently working in general practice. Ninety-six consented to take part and, of these, 79 completed a morbidity and treatment survey of 100 patient encounters (response rate 65.3%). RESULTS: The intervention group (n = 37) maintained their pattern of prescribing of antibiotics for URTI and choice of antibiotic for tonsillitis/streptococcal pharyngitis, with no significant change between the completion of the original study and the 5-year follow-up. The control group (n = 42) showed a downward trend in antibiotic prescribing for URTI, with the effect that no significant differences remained between groups at the 5-year follow-up. At the 5-year follow-up, both groups prescribed significantly fewer antibiotics for URTI and showed greater adherence to prescribing guidelines for tonsillitis/streptococcal pharyngitis than participants in a large national GP survey (n = 984). CONCLUSION: This study demonstrated maintenance of prescribing behaviour in the intervention group in the long term. However, the changes in prescribing observed in the control group and the power limitations of the study make it uncertain whether this was the result of a sustained effect of the educational intervention. The differences in both groups from the large national GP survey suggest that other influences on prescribing (such as participation in vocational training for general practice) were also having an important effect.",0,0,
210,211,Transfusion Medicine,"The evolution of transfusion medicine into a clinically oriented discipline emphasising patient care has been accompanied by challenges that need to be faced as specialists look to the future. Emerging issues that affect blood safety and blood supply, such as pathogen inactivation and more stringent donor screening questions, bring new pressures on the availability of an affordable blood supply. Imminent alternatives for management of anaemia, such as oxygen carriers, hold great promise but, if available, will require close oversight. With current estimates of HIV or hepatitis C viral (HCV) transmission approaching one in 2 000 000 units transfused, keeping to a minimum bacterial contamination of platelet products (one in 2000) and errors in transfusion, with its estimated one in 800 000 mortality rate, assume great urgency. Finally, serious difficulties in blood safety and availability for poor, developing countries require innovative strategies and commitment of resources.",0,0,
211,212,Protocol for a systematic review of evaluation research for adults who have participated in the 'SMART recovery' mutual support programme,"INTRODUCTION: Self-Management and Recovery Training (SMART Recovery) offers an alternative to predominant 12-step approaches to mutual aid (eg, alcoholics anonymous). Although the principles (eg, self-efficacy) and therapeutic approaches (eg, motivational interviewing and cognitive behavioural therapy) of SMART Recovery are evidence based, further clarity regarding the direct evidence of its effectiveness as a mutual aid package is needed. Relative to methodologically rigorous reviews supporting the efficacy of 12-step approaches, to date, reviews of SMART Recovery have been descriptive. We aim to address this gap by providing a comprehensive overview of the evidence for SMART Recovery in adults with problematic alcohol, substance and/or behavioural addiction, including a commentary on outcomes assessed, potential mediators, feasibility (including economic outcomes) and a critical evaluation of the methods used. METHODS AND ANALYSIS: Methods are informed by the Cochrane Guidelines for Systematic Reviews and the Preferred Reporting Items for Systematic Reviews and Meta-Analysis statement. 6 electronic peer-reviewed and 4 grey literature databases have been identified. Preliminary searches have been conducted for SMART Recovery literature (liberal inclusion criteria, not restricted to randomised controlled trials (RCTs), qualitative-only designs excluded). Eligible 'evaluation' articles will be assessed against standardised criteria and checked by an independent assessor. The searches will be re-run just before final analyses and further studies retrieved for inclusion. A narrative synthesis of the findings will be reported, structured around intervention type and content, population characteristics, and outcomes. Where possible, 'summary of findings' tables will be generated for each comparison. When data are available, we will calculate a risk ratio and its 95% CI (dichotomous outcomes) and/or effect size according to Cohen's formula (continuous outcomes) for the primary outcome of each trial. ETHICS AND DISSEMINATION: No ethical issues are foreseen. Findings will be disseminated widely to clinicians and researchers via journal publication and conference presentation(s). PROSPERO REGISTRATION NUMBER: CRD42015025574.",0,0,
212,213,"Randomised controlled trial of Alexander technique lessons, exercise, and massage (ATEAM) for chronic and recurrent back pain: economic evaluation","OBJECTIVE An economic evaluation of therapeutic massage, exercise, and lessons in the Alexander technique for treating persistent back pain. DESIGN Cost consequences study and cost effectiveness analysis at 12 month follow-up of a factorial randomised controlled trial. PARTICIPANTS 579 patients with chronic or recurrent low back pain recruited from primary care. INTERVENTIONS Normal care (control), massage, and six or 24 lessons in the Alexander technique. Half of each group were randomised to a prescription for exercise from a doctor plus behavioural counselling from a nurse. MAIN OUTCOME MEASURES Costs to the NHS and to participants. Comparison of costs with Roland-Morris disability score (number of activities impaired by pain), days in pain, and quality adjusted life years (QALYs). Comparison of NHS costs with QALY gain, using incremental cost effectiveness ratios and cost effectiveness acceptability curves. RESULTS Intervention costs ranged from pound30 for exercise prescription to pound596 for 24 lessons in Alexander technique plus exercise. Cost of health services ranged from pound50 for 24 lessons in Alexander technique to pound124 for exercise. Incremental cost effectiveness analysis of single therapies showed that exercise offered best value ( pound61 per point on disability score, pound9 per additional pain-free day, pound2847 per QALY gain). For two-stage therapy, six lessons in Alexander technique combined with exercise was the best value (additional pound64 per point on disability score, pound43 per additional pain-free day, pound5332 per QALY gain). CONCLUSIONS An exercise prescription and six lessons in Alexander technique alone were both more than 85% likely to be cost effective at values above pound20 000 per QALY, but the Alexander technique performed better than exercise on the full range of outcomes. A combination of six lessons in Alexander technique lessons followed by exercise was the most effective and cost effective option.",0,0,
213,214,Psychiatric experimentation: the lessons of history,,0,0,
214,215,"The effects of maternal depression, anxiety, and perceived stress during pregnancy on preterm birth: A systematic review","BACKGROUND: Experiencing psychological distress such as depression, anxiety, and/or perceived stress during pregnancy may increase the risk for adverse birth outcomes, including preterm birth. Clarifying the association between exposure and outcome may improve the understanding of risk factors for prematurity and guide future clinical and research practices. AIM: The aims of the present review were to outline the evidence on the risk of preterm associated with antenatal depression, anxiety, and stress. METHODS: Four electronic database searches were conducted to identify quantitative population-based, multi-centre, cohort studies and randomised-controlled trial studies focusing on the association between antenatal depression, anxiety, and stress, and preterm birth published in English between 1980 and 2013. FINDINGS: Of 1469 electronically retrieved articles, 39 peer-reviewed studies met the final selection criteria and were included in this review following the PRISMA and MOOSE review guidelines. Information was extracted on study characteristics"";"" depression, anxiety and perceived stress were examined as separate and combined exposures. There is strong evidence that antenatal distress during the pregnancy increases the likelihood of preterm birth. CONCLUSION: Complex paths of significant interactions between depression, anxiety and stress, risk factors and preterm birth were indicated in both direct and indirect ways. The effects of pregnancy distress were associated with spontaneous but not with medically indicated preterm birth. Health practitioners engaged in providing perinatal care to women, such as obstetricians, midwives, nurses, and mental health specialists need to provide appropriate support to women experiencing psychological distress in order to improve outcomes for both mothers and infants.",0,0,
